example,iftwotablesareforeignkeysforeachother,itmaynotbepossibletoINSERTintoonetable
withouthavingtheothertablerow alreadypresent. AsolutionistousetheDEFERRABLEforeign
key option and SET CONSTRAINTSso that foreign key constraints are checkedonly at transaction
commit. With this approach, a multiquery transaction can make table modifications that violate
foreign key constraints inside the transaction as long as the foreign key constraints are met at
14.4. FOREIGNKEY/REFERENCES 165
test=> INSERT INTO primarytest2
test-> VALUES (1,2);
INSERT 148816 1
test=> INSERT INTO foreigntest2
test-> VALUES (1,2);
INSERT 148817 1
test=> UPDATE foreigntest2
test-> SET col4 = NULL;
UPDATE 1
test=> CREATE TABLE matchtest (
test(> col3 INTEGER,
test(> col4 INTEGER,
test(> FOREIGN KEY (col3, col4) REFERENCES primarytest2
test(> MATCH FULL
test(> );
NOTICE: CREATE TABLE will create implicit trigger(s) for FOREIGN KEY check(s)
CREATE
test=> UPDATE matchtest
test-> SET col3 = NULL, col4 = NULL;
UPDATE 1
test=> UPDATE matchtest
test-> SET col4 = NULL;
ERROR:  referential integrity violation -
MATCH FULL doesn’t allow mixing of NULL and NON-NULL key values
Figure14.13: MATCHFULLforeignkey
166 CHAPTER14. CONSTRAINTS
transactionscommit. Figure14.14isacontrivedexampleofthiscase;theproperwaytoperform
thisqueryistoINSERTintoprimarytestfirst,thenINSERTintodefertest. Incomplexsituations,such
reordering might not be possible, so DEFERRABLEand SET CONSTRAINTSshould be used to defer
foreignkeyconstraints. AforeignkeymayalsobeconfiguredasINITIALLYDEFERRED,causingthe
constrainttobecheckedonlyattransactioncommitbydefault.
You cannameconstraintsifdesired. Theconstraintnameswill appearin constraintviolation
messagesandcanbeusedbySETCONSTRAINTS. SeetheCREATE_TABLEandSETmanualpagesfor
moreinformation.
14.5 CHECK
TheCHECKconstraintenforcescolumnvaluerestrictions. Suchconstraintscanrestrictacolumn,
forexample,toasetofvalues,onlypositivenumbers,orreasonabledates. Figure14.15showsan
exampleofCHECKconstraintsusingamodifiedversionofthefriendtablefromFigure3.2,page13.
ThisfigurehasmanyCHECKclauses:
state Forces the column to be two characters long. CHAR() pads the field with spaces, so state
mustbetrim()-edoftrailingspacesbeforelength()iscomputed.
age Forcesthecolumntoholdonlypositivevalues.
gender ForcesthecolumntoholdeitherM orF.
last_met ForcesthecolumntoincludedatesbetweenJanuary1,1950,andthecurrentdate.
table ForcesthetabletoacceptonlyrowswherefirstnameisnotEDorlastnameisnotRIVERS.
TheeffectistopreventEdRiversfrombeingenteredintothetable. Hisnamewillberejected
if it is in uppercase, lowercase, or mixed case. This restriction must be implementedas a
table-level CHECK constraint. Comparing firstname to ED at the column level would have
preventedallEDsfrombeingentered,whichwasnotdesired. Instead,thedesiredrestriction
isacombinationoffirstnameandlastname.
Next,theexampletriestoINSERTarowthatviolatesallCHECKconstraints. AlthoughtheCHECK
failedonthefriend2_last_metconstraint,ifthatwerecorrected,theotherconstraintswouldprevent
theinsertion. Bydefault,CHECKallowsNULLvalues.
14.6 Summary
This chapter covered a variety of constraints that help restrict user data within specifiedlimits.
Withsmalldatabases,constraintsareofmarginalbenefit. Withdatabasesholdingmillionsofrows,
however,theyhelpkeepdatabaseinformationorganizedandcomplete.
14.6. SUMMARY 167
test=> CREATE TABLE defertest(
test(> col2 INTEGER REFERENCES primarytest
test(> DEFERRABLE
test(> );
NOTICE: CREATE TABLE will create implicit trigger(s) for FOREIGN KEY check(s)
CREATE
test=> BEGIN;
BEGIN
test=> -- INSERT is attempted in non-DEFERRABLE mode
test=>
test=> INSERT INTO defertest VALUES (5);
ERROR:  referential integrity violation -
key referenced from defertest not found in primarytest
test=> COMMIT;
COMMIT
test=> BEGIN;
BEGIN
test=> -- all foreign key constraints are set to DEFERRED
test=>
test=> SET CONSTRAINTS ALL DEFERRED;
SET CONSTRAINTS
test=> INSERT INTO defertest VALUES (5);
INSERT 148946 1
test=> INSERT INTO primarytest VALUES (5);
INSERT 148947 1
test=> COMMIT;
COMMIT
Figure14.14: DEFERRABLEforeignkeyconstraint
test=> CREATE TABLE friend2 (
test(> firstname CHAR(15),
test(> lastname CHAR(20),
test(> city CHAR(15),
test(> state CHAR(2) CHECK (length(trim(state)) = 2),
test(> age INTEGER CHECK (age >= 0),
test(> gender CHAR(1) CHECK (gender IN (’M’,’F’)),
test(> last_met DATE CHECK (last_met BETWEEN ’1950-01-01’
test(> AND CURRENT_DATE),
test(> CHECK (upper(trim(firstname)) != ’ED’ OR
test(> upper(trim(lastname)) != ’RIVERS’)
test(> );
CREATE
test=> INSERT INTO friend2
test-> VALUES (’Ed’, ’Rivers’, ’Wibbleville’, ’J’, -35, ’S’, ’1931-09-23’);
ERROR: ExecAppend: rejected due to CHECK constraint friend2_last_met
Figure14.15: CHECKconstraints
Chapter 15
Importing and Exporting Data
COPYallowsrapidloadingandunloadingofusertables. Thiscommandcanwritethecontentsofa
tabletoanASCIIfileorloadatablefromanASCIIfile. Thesefilescanbeusedforbackuppurposes
ortotransferdatabetweenPOSTGRESQLandotherapplications.
Thefirstsectionofthischapterdescribestheuseof COPYtounloadandloaddatabasetables.
The next part of the chapter shows how to use COPYto share data with other applications. The
finalsectioncontainstipsforusingCOPY.
15.1 Using COPY
COPY…TO allows you to copy the contents of a table to a file. The file can later be read using
COPY…FROM.
Figure 15.1 shows the creation of a table with columns of various types. Two rows are then
insertedinto copytest. SELECTshowsthecontentsofthetable,andCOPY…TOwritesthetableto
thefile/tmp/copytest.out. Therowsarethendeleted. Finally,COPY…FROMreloadsthetable,as
shownbythelastSELECT.
COPY provides a quick way to load and unload tables. It is used for database backup (see
Section20.5). ThefollowingsectionscovervariousCOPYfeaturesthatareimportantwhenreading
orwritingCOPYfilesinotherapplications.
15.2 COPY File Format
COPY…TOcanexportdatatobe loadedintootherapplications,andCOPY…FROMcanimportdata
fromotherapplications. IfyouareconstructingafileforusewiththeCOPYcommandorarereading
aCOPYfileinanotherapplication,itisimportanttounderstandCOPY’sfileformat.
Figure 15.2 shows the contents of the COPY file from Figure 15.1. First, \q exits psql to an
169
170 CHAPTER15. IMPORTINGANDEXPORTINGDATA
test=> CREATE TABLE copytest (
test(> intcol INTEGER,
test(> numcol NUMERIC(16,2),
test(> textcol TEXT,
test(> boolcol BOOLEAN
test(> );
CREATE
test=> INSERT INTO copytest
test-> VALUES (1, 23.99, ’fresh spring water’, ’t’);
INSERT 174656 1
test=> INSERT INTO copytest
test-> VALUES (2, 55.23, ’bottled soda’, ’t’);
INSERT 174657 1
test=> SELECT * FROM copytest;
intcol | numcol | textcol | boolcol
--------+--------+--------------------+---------
1 | 23.99 | fresh spring water | t
2 | 55.23 | bottled soda | t
(2 rows)
test=> COPY copytest TO ’/tmp/copytest.out’;
COPY
test=> DELETE FROM copytest;
DELETE 2
test=> COPY copytest FROM ’/tmp/copytest.out’;
COPY
test=> SELECT * FROM copytest;
intcol | numcol | textcol | boolcol
--------+--------+--------------------+---------
1 | 23.99 | fresh spring water | t
2 | 55.23 | bottled soda | t
(2 rows)
Figure15.1: Exampleof COPY…TOandCOPY…FROM
15.3. DELIMITERS 171
test=> \q
$ cat /tmp/copytest.out
1 23.99 fresh spring water t
2 55.23 bottled soda t
$ sed ’s/ //g’ /tmp/copytest.out # the gap between / / is a TAB
123.99fresh spring watert
255.23bottled sodat
Figure15.2: Exampleof COPY…FROM
operatingsystemprompt. Then,theUnixcat1commanddisplaysthefile/tmp/copytest.out. This
filecontainsonelineforeveryrowinthetable. Columnsinthefileareseparatedbytabs. These
tabsarecalleddelimitersbecausetheydelimit(thatis,separate)columns.
Tabsaredifficulttoseebecausetheylooklikemultiplespaces. Thenextcommandprocesses
thefileusingsed2 todisplaytabsas. Thisoptionclearlyshowsthetabsinthefile,which
differfromspaces.
The columns in Figure 15.2 do not line up as they do in psql, because they are of different
lengths. Thevalueoftextcolinthefirstlineislongerthanthevalueinthesecondline. Thelackof
alignmentisexpectedbecausetheCOPYfileisdesignedforeasyprocessing,withonetabbetween
eachcolumn. Itisnotdesignedfordisplaypurposes.
15.3 DELIMITERS
You can easily change the default tab column delimiter. COPY’s USING DELIMITERS option allows
youtosetthecolumndelimiter. InFigure15.3,settingthedelimitertoapipesymbol(|)causes
theoutputfiletousepipestoseparatecolumns.
If a COPY file does not use the default tab column delimiter, COPY…FROM must employ the
proper USING DELIMITERS option. As shown in Figure 15.4, if a file uses pipes rather than tabs
ascolumndelimiters,COPY…FROMmustspecifypipesasdelimiters. ThefirstCOPY…FROMfails
becauseitcannotfindatabtoseparatethecolumns. ThesecondCOPY…FROMsucceedsbecause
theproperdelimiterforthefilewasused.
1Non-Unixoperatingsystemuserswouldusethetypecommand.
2Thesedoperatingsystemcommandreplacesonestringwithanother.Seethesed(1)manualpageformoreinformation.
172 CHAPTER15. IMPORTINGANDEXPORTINGDATA
test=> COPY copytest TO ’/tmp/copytest.out’ USING DELIMITERS ’|’;
COPY
test=> \q
$ cat /tmp/copytest.out
1|23.99|fresh spring water|t
2|55.23|bottled soda|t
Figure15.3: Exampleof COPY…TO…USINGDELIMITERS
test=> DELETE FROM copytest;
DELETE 2
test=>
test=> COPY copytest FROM ’/tmp/copytest.out’;
ERROR: copy: line 1, pg_atoi: error in "1|23.99|fresh spring water|t": can-
not parse "|23.99|fresh spring water|t"
test=>
test=> COPY copytest FROM ’/tmp/copytest.out’ USING DELIMITERS ’|’;
COPY
Figure15.4: Exampleof COPY…FROM…USINGDELIMITERS
15.4. COPYWITHOUTFILES 173
test=> COPY copytest FROM stdin;
Enter data to be copied followed by a newline.
End with a backslash and a period on a line by itself.
test> 3 77.43 coffee f
test> \.
test=> COPY copytest TO stdout;
1 23.99 fresh spring water t
2 55.23 bottled soda t
3 77.43 coffee f
test=>
Figure15.5: COPYusingstdinandstdout
15.4 COPY Without Files
COPYcanalsobeusedwithoutfiles. Thecommandcan,forexample,usethesameinputandoutput
locations used by psql. The specialname stdin representsthe psql input, and stdout represents
the psql output. Figure 15.5 shows how you can use stdin to supply COPY input directly from
your keyboard. For clarity,texttypedby theuserappearsin bold. Thegapsinthesecondtyped
linewere generatedby pressingthe tab key. The usertyped\. to exitCOPY…FROM. A COPY to
stdoutoperationdisplaystheCOPYoutputonyourscreen,whichcanbeusefulwhenusingpsqlin
automatedscripts.
15.5 Backslashes and NULL Values
Thereispotentialforconfusionifthecharacterusedasacolumndelimiteralsoexistsinuserdata.
If both appearthe samewayin thefile, COPY…FROMwould be unableto determinewhetherthe
characterisadelimiteroruserdata.
COPYavoidsanyconfusionbyspeciallymarkingdelimitersappearinginuserdata. Itprecedes
themwithabackslash(\). Ifapipeisthe delimiter,COPY…TOusespipes(|)for delimiters,and
backslash-pipes(\|)forpipesinuserdata. InFigure15.6,forexample,eachcolumnisseparated
byapipe,butthepipethatappearsinuserdataisoutputasabc\|def.
Use of a backslash causes any characterthat follows it to be treated specially. As a result, a
backslashinuserdataisoutputastwobackslashes(\\).
AnotherspecialbackslashusedinFigure15.6is\N,whichrepresentsNULL. ItpreventsNULL
valuesfrombeingconfusedwithuservalues.
To change the default NULL representation, you use WITH NULL AS. For example, the com-
mand COPY copytest TO ’/tmp/copytest.out’ WITH NULL AS ’?’ will output NULL values as ques-
174 CHAPTER15. IMPORTINGANDEXPORTINGDATA
test=> DELETE FROM copytest;
DELETE 3
test=> INSERT INTO copytest
test-> VALUES (4, 837.20, ’abc|def’, NULL);
INSERT 174786 1
test=> COPY copytest TO stdout USING DELIMITERS ’|’;
4|837.20|abc\|def|\N
Figure15.6: COPYbackslashhandling
Backslash String Meaning
\TAB tabifusingdefaultdelimitertab
\| pipeifusingpipeasthedelimiter
\N NULLifusingthedefaultNULLoutput
\b backspace
\f formfeed
\n newline
\r carriagereturn
\t tab
\v verticaltab
\### characterrepresentedbyoctalnumber###
\\ backslash
Table15.1: BackslashesunderstoodbyCOPY
tionmarks. Unfortunately,itwillmakeausercolumncontainingasinglequestionmarkindistin-
guishablefromaNULLinthefile. TooutputNULLvaluesasblankcolumns,usethecommandCOPY
copytest TO ’/tmp/copytest.out’ WITH NULL AS ’\,’. TotreatemptycolumnsasNULLvalueson
input,useCOPY copytest FROM ’/tmp/copytest.out’ WITH NULL AS ’\,’.
Table 15.1 summarizes the delimiter, NULL, and backslash handling of COPY. The first two
lines in the table show that preceding a character with a backslash prevents the character from
being interpreted as a delimiter. The next line shows that \N means NULL under the default
representation. Theotherbackslashentriesshowsimplerepresentationsforcommoncharacters.
Thelastlineshowsthatadouble-backslashisrequiredtorepresentaliteralbackslash.
15.6. COPYTIPS 175
15.6 COPY Tips
You must use full path names with the COPY command because the database server runs in a
differentdirectorythanthepsqlclient. Filesarereadandwrittenbythepostgresuser,sopostgres
musthavepermissiontoreadthefileforCOPY…FROManddirectorywritepermissionforCOPY…TO.
BecauseCOPYusesthelocalfilesystem,usersconnectingoveranetworkcannotusefilenames.
Theycanusestdinandstdout,orpsql’s\copycommand.
Bydefault,thesystem-generatedOIDcolumnisnotwrittenout,andloadedrowsreceivenew
OIDs. COPY…WITHOIDSallowsOIDstobewrittenandread.
COPY writes only entire tables. To COPY only part of a table, use SELECT…INTO TEMPORARY
TABLEwithanappropriateWHEREclauseandthenCOPYthetemporarytabletoafile.
SeetheCOPYmanualpageformoredetailedinformation.
15.7 Summary
COPYcanbethoughtofasacrudeINSERTandSELECTcommand. Itimportsandexportsdataina
verygenericformat,whichmakesitidealforusebyotherapplicationsandforbackuppurposes.
Chapter 16
Database Query Tools
ThischaptercoverstwopopularPOSTGRESQLdatabasequerytools: psqlandpgaccess.