FROM pg_stat_file('/usr/local/pgsql/data/base/16384/16385_init');
size
−−−−−−
0
(1 row)
Thefreespacemap2 keeps track of available space within pages. Its volume
changesallthetime,growingaftervacuumingandgettingsmallerwhennew
row versions appear. The free space map is used to quickly find a page that
canaccommodatenewdatabeinginserted.
1 postgresql.org/docs/14/storage-init.html
2 postgresql.org/docs/14/storage-fsm.html
backend/storage/freespace/README
24
1.1 DataOrganization
Allfilesrelatedtothefreespacemaphavethe_fsmsuffix. Initially,nosuch
files are created; they appear only when necessary. The easiest way to get
themistovacuumatable: p.
=> VACUUM t;
=> SELECT size
FROM pg_stat_file('/usr/local/pgsql/data/base/16384/16385_fsm');
size
−−−−−−−
24576
(1 row)
Tospeedupsearch,thefreespacemapisorganizedasatree;ittakesatleast
threepages(henceitsfilesizeforanalmostemptytable).
Thefreespacemapisprovidedforbothtablesandindexes.Butsinceanindex
row cannot be added into an arbitrary page (for example, -trees define the
placeofinsertionbythesortorder),Postgretracksonlythosepagesthat
havebeenfullyemptiedandcanbereusedintheindexstructure.
Thevisibilitymap1 can quickly show whether a page needs to be vacuumed or
frozen.Forthispurpose,itprovidestwobitsforeachtablepage.
The first bit is set for pages that contain only up-to-date row versions. Vac-
uumskipssuchpagesbecausethereisnothingtocleanup. Besides,whena p.
transactiontriestoreadarowfromsuchapage,thereisnopointinchecking
itsvisibility,soanindex-onlyscancanbeused.
Thesecondbitissetforpagesthatcontainonlyfrozenrowversions.Iwilluse v..
thetermfreezemaptorefertothispartofthefork. p.
Visibilitymapfileshavethe_vmsuffix.Theyareusuallythesmallestones:
=> SELECT size
FROM pg_stat_file('/usr/local/pgsql/data/base/16384/16385_vm');
size
−−−−−−
8192
(1 row)
Thevisibilitymapisprovidedfortables,butnotforindexes. p.
1 postgresql.org/docs/14/storage-vm.html
25
Chapter1 Introduction
Pages
p. Tofacilitate/,allfilesarelogicallysplitintopages(orblocks),whichrepresent
the minimum amount of data that can be read or written. Consequently, many
internalPostgrealgorithmsaretunedforpageprocessing.
Thepagesizeisusuallyk.Itcanbeconfiguredtosomeextent(uptok),but
onlyatbuildtime(./configure--with-blocksize),andnobodyusuallydoesit. Once
builtandlaunched,theinstancecanworkonlywithpagesofthesamesize; itis
impossibletocreatetablespacesthatsupportdifferentpagesizes.
Regardless of the fork they belong to, all the files are handled by the server in
p. roughlythesameway. Pagesarefirstmovedtothebuffercache(wheretheycan
bereadandupdatedbyprocesses)andthenflushedbacktodiskasrequired.
TOAST
Each row must fit a single page: there is no way to continue a row on the next
page.Tostorelongrows,Postgreusesaspecialmechanismcalled1(The
OversizedAttributesStorageTechnique).
T implies several strategies. You can move long attribute values into a sep-
arateservicetable,havingslicedthemintosmaller“toasts.” Anotheroptionisto
compressalongvalueinsuchawaythattherowfitsthepage.Oryoucandoboth:
firstcompressthevalue,andthensliceandmoveit.
If the main table contains potentially long attributes, a separate  table is
created for it right away,one for all the attributes. For example,if a table has a
columnofthenumericortexttype,atablewillbecreatedevenifthiscolumn
willneverstoreanylongvalues.
For indexes, the  mechanism can offer only compression; moving long at-
tributesintoaseparatetableisnotsupported.Itlimitsthesizeofthekeysthatcan
beindexed(theactualimplementationdependsonaparticularoperatorclass).
1 postgresql.org/docs/14/storage-toast.html
include/access/heaptoast.h
26
1.1 DataOrganization
Bydefault,thestrategyisselectedbasedonthedatatypeofacolumn.The
easiestwaytoreviewtheusedstrategiesistorunthe\d+commandinpsql,butI
willquerythesystemcatalogtogetanunclutteredoutput:
=> SELECT attname, atttypid::regtype,
CASE attstorage
WHEN 'p' THEN 'plain'
WHEN 'e' THEN 'external'
WHEN 'm' THEN 'main'
WHEN 'x' THEN 'extended'
END AS storage
FROM pg_attribute
WHERE attrelid = 't'::regclass AND attnum > 0;
attname | atttypid | storage
−−−−−−−−−+−−−−−−−−−−+−−−−−−−−−−
a | integer | plain
b | numeric | main
c | text | extended
d | json | extended
(4 rows)
Postgresupportsthefollowingstrategies:
plain meansthatisnotused(thisstrategyisappliedtodatatypesthatare
knowntobe“short,”suchastheintegertype).
extended allowsbothcompressingattributesandstoringtheminaseparate
table.
external implies that long attributes are stored in the  table in an uncom-
pressedstate.
main requires long attributes to be compressed first; they will be moved to the
tableonlyifcompressiondidnothelp.
In general terms, the algorithm looks as follows.1 Postgre aims at having at
leastfourrowsinapage. Soifthesizeoftherowexceedsonefourthofthepage,
excludingtheheader(forastandard-sizepageitisaboutbytes),wemustap-
plythemechanismtosomeofthevalues.Followingtheworkflowdescribed
below,westopassoonastherowlengthdoesnotexceedthethresholdanymore:
1 backend/access/heap/heaptoast.c
27
Chapter1 Introduction
1. First of all, we go through attributes with external and extended strategies,
startingfromthelongestones. Extendedattributesgetcompressed,andifthe
resultingvalue(onitsown,withouttakingotherattributesintoaccount)ex-
ceedsonefourthofthepage,itismovedtothetablerightaway.External
attributesarehandledinthesameway,exceptthatthecompressionstageis
skipped.
2. Iftherowstilldoesnotfitthepageafterthefirstpass,wemovetheremaining
attributesthatuseexternalorextendedstrategiesintothetable,oneby
one.
3. If it did not help either,we try to compress the attributes that use the main
strategy,keepingtheminthetablepage.
4. If the row is still not short enough, the main attributes are moved into the
table.
v. Thethresholdvalueisbytes,butitcanberedefinedatthetablelevelusing
thetoast_tuple_targetstorageparameter.
It may sometimes be useful to change the default strategy for some of the col-
umns. If it is known in advance that the data in a particular column cannot be
compressed(forexample,thecolumnstoresimages),youcansettheexternal
strategy for this column; it allows you to avoid futile attempts to compress the
data.Thestrategycanbechangedasfollows:
=> ALTER TABLE t ALTER COLUMN d SET STORAGE external;
Ifwerepeatthequery,wewillgetthefollowingresult:
attname | atttypid | storage
−−−−−−−−−+−−−−−−−−−−+−−−−−−−−−−
a | integer | plain
b | numeric | main
c | text | extended
d | json | external
(4 rows)
T tables reside in a separate schema called pg_toast; it is not included into
the search path, so  tables are usually hidden. For temporary tables,
pg_toast_temp_Nschemasareused,byanalogywithpg_temp_N.
28
1.1 DataOrganization
Let’stakealookattheinnermechanicsoftheprocess. Supposetabletcontains
three potentially long attributes; it means that there must be a corresponding
table.Hereitis:
=> SELECT relnamespace::regnamespace, relname
FROM pg_class
WHERE oid = (
SELECT reltoastrelid
FROM pg_class WHERE relname = 't'
);
relnamespace | relname
−−−−−−−−−−−−−−+−−−−−−−−−−−−−−−−
pg_toast | pg_toast_16385
(1 row)
=> \d+ pg_toast.pg_toast_16385
TOAST table "pg_toast.pg_toast_16385"
Column | Type | Storage
−−−−−−−−−−−−+−−−−−−−−−+−−−−−−−−−
chunk_id | oid | plain
chunk_seq | integer | plain
chunk_data | bytea | plain
Owning table: "public.t"
Indexes:
"pg_toast_16385_index" PRIMARY KEY, btree (chunk_id, chunk_seq)
Access method: heap
Itisonlylogicalthattheresultingchunksofthetoastedrowusetheplainstrategy:
thereisnosecond-level.
Apartfromthetableitself,Postgrecreatesthecorrespondingindexin
the same schema. This index is always used to access  chunks. The name
of the index is displayed in the output, but you can also view it by running the
followingquery:
=> SELECT indexrelid::regclass FROM pg_index
WHERE indrelid = (
SELECT oid
FROM pg_class WHERE relname = 'pg_toast_16385'
);
indexrelid
−−−−−−−−−−−−−−−−−−−−−−−−−−−−−−−
pg_toast.pg_toast_16385_index
(1 row)
29
Chapter1 Introduction
=> \d pg_toast.pg_toast_16385_index
Unlogged index "pg_toast.pg_toast_16385_index"
Column | Type | Key? | Definition
−−−−−−−−−−−+−−−−−−−−−+−−−−−−+−−−−−−−−−−−−
chunk_id | oid | yes | chunk_id
chunk_seq | integer | yes | chunk_seq
primary key, btree, for table "pg_toast.pg_toast_16385"
Thus,atableincreasestheminimumnumberofforkfilesusedbythetable
up to eight: three for the main table,three for the  table,and two for the
index.
Columncusestheextendedstrategy,soitsvalueswillbecompressed:
=> UPDATE t SET c = repeat('A',5000);
=> SELECT * FROM pg_toast.pg_toast_16385;
chunk_id | chunk_seq | chunk_data
−−−−−−−−−−+−−−−−−−−−−−+−−−−−−−−−−−−
(0 rows)
The  table is empty: repeated symbols have been compressed by the  al-
gorithm,sothevaluefitsthetablepage.
Andnowlet’sconstructthisvalueofrandomsymbols:
=> UPDATE t SET c = (
SELECT string_agg( chr(trunc(65+random()*26)::integer), '')
FROM generate_series(1,5000)
)
RETURNING left(c,10) || '...' || right(c,10);
?column?
−−−−−−−−−−−−−−−−−−−−−−−−−
KRAZUZAWGE...UVRXRWJPYB
(1 row)
UPDATE 1
Thissequencecannotbecompressed,soitgetsintothetable:
=> SELECT chunk_id,
chunk_seq,
length(chunk_data),
left(encode(chunk_data,'escape')::text, 10) || '...' ||
right(encode(chunk_data,'escape')::text, 10)
FROM pg_toast.pg_toast_16385;
30
1.2 ProcessesandMemory
chunk_id | chunk_seq | length | ?column?
−−−−−−−−−−+−−−−−−−−−−−+−−−−−−−−+−−−−−−−−−−−−−−−−−−−−−−−−−
16390 | 0 | 1996 | KRAZUZAWGE...OSREMITVWR
16390 | 1 | 1996 | IIIAAPCKUF...GBPMOOTBID
16390 | 2 | 1008 | XTDOFJVSOS...UVRXRWJPYB
(3 rows)
Wecanseethatthecharactersareslicedintochunks.Thechunksizeisselectedin
suchawaythatthepageofthetablecanaccommodatefourrows.Thisvalue
variesalittlefromversiontoversiondependingonthesizeofthepageheader.
Whenalongattributeisaccessed,Postgreautomaticallyrestorestheoriginal
valueandreturnsittotheclient;itallhappensseamlesslyfortheapplication. If
longattributesdonotparticipateinthequery,thetablewillnotbereadat
all. Itisoneofthereasonswhyyoushouldavoidusingtheasteriskinproduction
solutions.
Iftheclientqueriesoneofthefirstchunksofalongvalue,Postgrewillreadthe v.
requiredchunksonly,evenifthevaluehasbeencompressed.
Nevertheless, data compression and slicing require a lot of resources; the same
goes for restoring the original values. That’s why it is not a good idea to keep
bulky data in Postgre, especially if this data is being actively used and does
notrequiretransactionallogic(likescannedaccountingdocuments).Apotentially
betteralternativeistostoresuchdatainthefilesystem,keepinginthedatabase
onlythe names ofthe correspondingfiles. But thenthe database system cannot
guaranteedataconsistency.
1.2 Processes and Memory
APostgreserverinstanceconsistsofseveralinteractingprocesses.
The first process launched at the server start is postgres, which is traditionally
calledpostmaster.Itspawnsalltheotherprocesses(Unix-likesystemsusethefork
system call for this purpose) and supervises them: if any process fails, postmas-
terrestartsit(orthewholeserverifthereisariskthattheshareddatahasbeen
damaged).
31
Chapter1 Introduction
Because of its simplicity,the process model has been used in Postgre from thevery
beginning,andeversincetherehavebeenunendingdiscussionsaboutswitchingoverto
threads.
Thecurrentmodelhasseveraldrawbacks: staticsharedmemoryallocationdoesnotallow
resizing structures like buffer cache on the fly; parallel algorithms are hard to imple-
mentandlessefficientthantheycouldbe;sessionsaretightlyboundtoprocesses.Using
threadssoundspromising,eventhoughitinvolvessomechallengesrelatedtoisolation,
OS compatibility,and resource management. However,their implementation would re-
quirearadicalcodeoverhaulandyearsofwork,soconservativeviewsprevailfornow: no
suchchangesareexpectedinthenearfuture.
Serveroperationismaintainedbybackgroundprocesses.Herearethemainones:
startup restoresthesystemafterafailure.
p. autovacuum removesstaledatafromtablesandindexes.
p. walwriter writesentriestodisk.
p. checkpointer executescheckpoints.
p. writer flushesdirtypagestodisk.
statscollector collectsusagestatisticsfortheinstance.
walsender sendsentriestoareplica.
walreceiver getsentriesonareplica.
Some of these processes are terminated once the task is complete,others run in
thebackgroundallthetime,andsomecanbeswitchedoff.
Eachprocessismanagedbyconfigurationparameters,sometimesbydozensofthem. To
setuptheserverinacomprehensivemanner,youhavetobeawareofitsinnerworkings.
Butgeneralconsiderationswillonlyhelpyouselectmoreorlessadequateinitialvalues;
lateron,thesesettingshavetobefine-tunedbasedonmonitoringdata.
Toenableprocessinteraction,postmasterallocatessharedmemory,whichisavail-
abletoalltheprocesses.
Since disks (especially ,but  too) are much slower than ,Postgre
p. usescaching: somepartofthesharedisreservedforrecentlyreadpages,in
hopethattheywillbeneededmorethanonceandtheoverheadofrepeateddisk
32
1.3 ClientsandtheClient-ServerProtocol
accesswillbereduced. Modifieddataisalsoflushedtodiskaftersomedelay,not
immediately.
Buffercachetakesthegreaterpartofthesharedmemory,whichalsocontainsother
buffersusedbytheservertospeedupdiskaccess.