Ondisk,theisstoredinthe/pg_waldirectoryasseparatefiles,orseg-
16MB ments.Theirsizeisshownbytheread-onlywal_segment_sizeparameter.
v. For high-load systems, it makes sense to increase the segment size since it may
reduce the overhead,but this setting can be modified only during cluster initial-
ization(initdb--wal-segsize).
W entries get into the current file until it runs out of space; then Postgre
startsanewfile.
Wecanlearninwhichfileaparticularentryislocated,andatwhatoffsetfromthe
startofthefile:
=> SELECT file_name, upper(to_hex(file_offset)) file_offset
FROM pg_walfile_name_offset('0/3E820AC8');
file_name | file_offset
−−−−−−−−−−−−−−−−−−−−−−−−−−+−−−−−−−−−−−−−
00000001000000000000003E | 820AC8
(1 row)
timeline logsequencenumber
The name of the file consists of two parts. The highest eight hexadecimal digits
define the timeline used for recovery from a backup,while the rest represent the
highestbits(thelowestbitsareshowninthefile_offsetfield).
v. Toviewthecurrentfiles,youcancallthefollowingfunction:
=> SELECT *
FROM pg_ls_waldir()
WHERE name = '00000001000000000000003E';
190
10.3 Checkpoint
name | size | modification
−−−−−−−−−−−−−−−−−−−−−−−−−−+−−−−−−−−−−+−−−−−−−−−−−−−−−−−−−−−−−−
00000001000000000000003E | 16777216 | 2022−09−19 14:52:22+03
(1 row)
Now let’s take a look at the headers of the newly created  entries using the
pg_waldumputility,whichcanfilterentriesbothbytherange(likeinthis
example)andbyaparticulartransaction.
The pg_waldump utility should be started on behalf of the postgres  user,as it
needsaccesstofilesondisk.
postgres$ /usr/local/pgsql/bin/pg_waldump \
-p /usr/local/pgsql/data/pg_wal -s 0/3E820AC8 -e 0/3E820B38#
rmgr: Heap len (rec/tot): 69/ 69, tx: 887, lsn:
0/3E820AC8, prev 0/3E820AA0, desc: HOT_UPDATE off 1 xmax 887 flags
0x40 ; new off 2 xmax 0, blkref #0: rel 1663/16391/16562 blk 0
rmgr: Transaction len (rec/tot): 34/ 34, tx: 887, lsn:
0/3E820B10, prev 0/3E820AC8, desc: COMMIT 2022−09−19 14:52:22.552253
MSK
Herewecanseetheheadersoftwoentries.
Thefirstoneisthe_operationhandledbytheHeapresourcemanager. p.
Theblkreffieldshowsthefilenameandthepageoftheupdatedheappage:
=> SELECT pg_relation_filepath('wal');
pg_relation_filepath
−−−−−−−−−−−−−−−−−−−−−−
base/16391/16562
(1 row)
The second entry is the  operation supervised by theTransaction resource
manager.
10.3 Checkpoint
Torestoredataconsistencyafterafailure(thatis,toperformrecovery),Postgre
hastoreplaytheintheforwarddirectionandapplytheentriesthatrepresent
lostchangestothecorrespondingpages. Tofindoutwhathasbeenlost,the
191
Chapter10 Write-AheadLog
ofthepagestoredondiskiscomparedtotheoftheentry. Butatwhich
pointshouldwestarttherecovery? Ifwestarttoolate,thepageswrittentodisk
beforethispointwillfailtoreceiveallthechanges,whichwillleadtoirreversible
data corruption. Starting from the very beginning is unrealistic: it is impossible
tostoresuchapotentiallyhugevolumeofdata,andneitherisitpossibletoaccept
suchalongrecoverytime.Weneedacheckpointthatisgraduallymovingforward,
thusmakingitsafetostarttherecoveryfromthispointandremovealltheprevious
entries.
The most straightforward way to create a checkpoint is to periodically suspend
allsystemoperationsandforcealldirtypagestodisk. Thisapproachisofcourse
unacceptable,asthesystemwillhangforanindefinitebutquitesignificanttime.
For this reason,the checkpoint is spread out over time,virtually constituting an
interval.Checkpointexecutionisperformedbyaspecialbackgroundprocesscalled
checkpointer.1
Checkpointstart. The checkpointer process flushes to disk everything that can be
writteninstantaneously: transactionstatus,subtransactions’metadata,
andafewotherstructures.
Checkpointexecution. Mostofthecheckpointexecutiontimeisspentonflushing
dirtypagestodisk.2
First,aspecialtagissetintheheadersofallthebuffersthatweredirtyatthe
checkpointstart.Ithappensveryfastsinceno/operationsareinvolved.
Thencheckpointertraversesallthebuffersandwritesthetaggedonestodisk.
Theirpagesarenotevictedfromthecache: theyaresimplywrittendown,so
usageandpincountscanbeignored.
v.. Pages are processed in the order of their s to avoid random writing if pos-
sible. For better load balancing,Postgre alternates between different ta-
blespaces(astheymaybelocatedondifferentphysicaldevices).
1 backend/postmaster/checkpointer.c
backend/access/transam/xlog.c,CreateCheckPointfunction
2 backend/storage/buffer/bufmgr.c,BufferSyncfunction
192
10.3 Checkpoint
Backendscanalsowritetaggedbufferstodisk—iftheygettothemfirst.Inany
case,buffertagsareremovedatthisstage,soforthepurposeofthecheckpoint
eachbufferwillbewrittenonlyonce.
Naturally,pagescanstillbemodifiedinthebuffercachewhilethecheckpoint
is in progress. But since new dirty buffers are not tagged, checkpointer will
ignorethem.
Checkpointcompletion. When all the buffers that were dirty at the start of the
checkpoint are written to disk,the checkpoint is considered complete. From
now on (but not earlier!), the start of the checkpoint will be used as a new
starting point of recovery. All the  entries written before this point are
notrequiredanymore.
startof
recovery
requiredWALfiles
failure time
checkpoint
startof
recovery
requiredWALfiles
failure time
checkpoint checkpoint
Finally,checkpointercreatesaentrythatcorrespondstothecheckpoint
completion,specifyingthecheckpoint’sstart. Sincethecheckpointlogs
nothingwhenitstarts,thiscanbelongtoaentryofanytype.
The/global/pg_controlfilealsogetsupdatedtorefertothelatestcom-
pleted checkpoint. (Until this process is over, pg_control keeps the previous
checkpoint.)
193
Chapter10 Write-AheadLog
PGDATA/global/pg_control
Latestcheckpointlocation: 0/3F09FA08
Latestcheckpoint'sREDOlocation: 0/3F09F9D0
checkpoint checkpoint
start finish
CHECKPOINT
To figure out once and for all what points where,let’s take a look at a simple ex-
ample.Wewillmakeseveralcachedpagesdirty:
=> UPDATE big SET s = 'FOO';
=> SELECT count(*) FROM pg_buffercache WHERE isdirty;
count
−−−−−−−
4119
(1 row)
Notethecurrentposition:
=> SELECT pg_current_wal_insert_lsn();
pg_current_wal_insert_lsn
−−−−−−−−−−−−−−−−−−−−−−−−−−−
0/3F09F9D0
(1 row)
Nowlet’scompletethecheckpointmanually.Allthedirtypageswillbeflushedto
disk;sincenothinghappensinthesystem,newdirtypageswillnotappear:
=> CHECKPOINT;
=> SELECT count(*) FROM pg_buffercache WHERE isdirty;
count
−−−−−−−
0
(1 row)
Let’sseehowthecheckpointisreflectedinthe:
194
10.4 Recovery
=> SELECT pg_current_wal_insert_lsn();
pg_current_wal_insert_lsn
−−−−−−−−−−−−−−−−−−−−−−−−−−−
0/3F09FA80
(1 row)
postgres$ /usr/local/pgsql/bin/pg_waldump \
-p /usr/local/pgsql/data/pg_wal -s 0/3F09F9D0 -e 0/3F09FA80
rmgr: Standby len (rec/tot): 50/ 50, tx: 0, lsn:
0/3F09F9D0, prev 0/3F09F9A8, desc: RUNNING_XACTS nextXid 889
latestCompletedXid 888 oldestRunningXid 889
rmgr: XLOG len (rec/tot): 114/ 114, tx: 0, lsn:
0/3F09FA08, prev 0/3F09F9D0, desc: CHECKPOINT_ONLINE redo
0/3F09F9D0; tli 1; prev tli 1; fpw true; xid 0:889; oid 24754; multi
1; offset 0; oldest xid 726 in DB 1; oldest multi 1 in DB 1;
oldest/newest commit timestamp xid: 0/0; oldest running xid 889;
online
Thelatestentryisrelatedtothecheckpointcompletion(_).
Thestartofthischeckpointisspecifiedafterthewordredo;thispositioncor-
respondstothelatestinsertedentryatthetimeofthecheckpointstart.
Thesameinformationcanalsobefoundinthepg_controlfile:
postgres$ /usr/local/pgsql/bin/pg_controldata \
-D /usr/local/pgsql/data | egrep 'Latest.*location'
Latest checkpoint location: 0/3F09FA08
Latest checkpoint's REDO location: 0/3F09F9D0
10.4 Recovery
Thefirstprocesslaunchedattheserverstartispostmaster. Initsturn,postmaster
spawnsthestartupprocess,1 whichtakescareofdatarecoveryincaseofafailure.
Todeterminewhetherrecoveryisneeded,thestartupprocessreadsthepg_control
fileandcheckstheclusterstatus.Thepg_controldatautilityenablesustoviewthe
contentofthisfile:
1 backend/postmaster/startup.c
backend/access/transam/xlog.c,StartupXLOGfunction
195
Chapter10 Write-AheadLog
postgres$ /usr/local/pgsql/bin/pg_controldata \
-D /usr/local/pgsql/data | grep state
Database cluster state: in production
Aproperlystoppedserverhasthe“shutdown”status; the“inproduction”status
ofanon-runningserverindicatesafailure.Inthiscase,thestartupprocesswillau-
tomaticallyinitiaterecoveryfromthestartofthelatestcompletedcheckpoint
foundinthesamepg_controlfile.
Ifthedirectorycontainsabackup_labelfilerelatedtoabackup,thestartposi-
tionistakenfromthatfile.
Thestartupprocessreadsentriesonebyone,startingfromthedefinedposi-
tion,andappliesthemtodatapagesiftheofthepageissmallerthanthe
oftheentry. Ifthepagecontainsabigger,shouldnotbeapplied;in
fact,itmustnotbeappliedbecauseitsentriesaredesignedtobereplayedstrictly
sequentially.
However,someentriesconstituteafullpageimage,or.Entriesofthistype
canbeappliedtoanystateofthepagesinceallthepagecontentswillbeerased
anyway.Suchmodificationsarecalledidempotent.Anotherexampleofanidempo-
tentoperationisregisteringtransactionstatuschanges: eachtransactionstatusis
definedinbycertainbitsthataresetregardlessoftheirpreviousvalues,so
thereisnoneedtokeeptheofthelatestchangeinpages.
Wentriesareappliedtopagesinthebuffercache,justlikeregularpageupdates
duringnormaloperation.
Filesgetrestoredfrominasimilarmanner: forexample,ifaentryshows
thatthefilemustexit,butitismissingforsomereason,itwillbecreatedanew.
Oncetherecoveryisover,allunloggedrelationsareoverwrittenbythecorrespond-
p. inginitializationforks.
Finally,thecheckpointisexecutedtosecuretherecoveredstateondisk.
Thejobofthestartupprocessisnowcomplete.
Initsclassicform,therecoveryprocessconsistsoftwophases. Intheroll-forwardphase,
entriesarereplayed,repeatingthelostoperations. Intheroll-backphase,theserver
abortsthetransactionsthatwerenotyetcommittedatthetimeofthefailure.
196
10.4 Recovery
InPostgre,thesecondphaseisnotrequired. Aftertherecovery,thewillcontain
neither commit nor abort bits for an unfinished transaction (which technically denotes
an active transaction),but since it is known for sure that the transaction is not running
anymore,itwillbeconsideredaborted.1
Wecansimulateafailurebyforcingtheservertostopintheimmediatemode:
postgres$ pg_ctl stop -m immediate
Hereisthenewclusterstate:
postgres$ /usr/local/pgsql/bin/pg_controldata \
-D /usr/local/pgsql/data | grep 'state'
Database cluster state: in production
Whenwelaunchtheserver,thestartupprocessseesthatafailurehasoccurredand
enterstherecoverymode:
postgres$ pg_ctl start -l /home/postgres/logfile
postgres$ tail -n 6 /home/postgres/logfile
LOG: database system was interrupted; last known up at 2022−09−19
14:52:23 MSK
LOG: database system was not properly shut down; automatic recovery
in progress
LOG: redo starts at 0/3F09F9D0
LOG: invalid record length at 0/3F09FA80: wanted 24, got 0
LOG: redo done at 0/3F09FA08 system usage: CPU: user: 0.00 s,
system: 0.00 s, elapsed: 0.00 s
LOG: database system is ready to accept connections
Iftheserverisbeingstoppednormally,postmasterdisconnectsallclientsandthen
executesthefinalcheckpointtoflushalldirtypagestodisk.
Notethecurrentposition:
=> SELECT pg_current_wal_insert_lsn();
pg_current_wal_insert_lsn
−−−−−−−−−−−−−−−−−−−−−−−−−−−
0/3F09FAF8
(1 row)
1 backend/access/heap/heapam_visibility.c,HeapTupleSatisfiesMVCCfunction
197
Chapter10 Write-AheadLog
Nowlet’sstoptheserverproperly:
postgres$ pg_ctl stop
Hereisthenewclusterstate:
postgres$ /usr/local/pgsql/bin/pg_controldata \
-D /usr/local/pgsql/data | grep state
Database cluster state: shut down
Attheendofthe,wecanseethe_entry,whichdenotes
thefinalcheckpoint:
postgres$ /usr/local/pgsql/bin/pg_waldump \
-p /usr/local/pgsql/data/pg_wal -s 0/3F09FAF8
rmgr: XLOG len (rec/tot): 114/ 114, tx: 0, lsn:
0/3F09FAF8, prev 0/3F09FA80, desc: CHECKPOINT_SHUTDOWN redo
0/3F09FAF8; tli 1; prev tli 1; fpw true; xid 0:889; oid 24754; multi
1; offset 0; oldest xid 726 in DB 1; oldest multi 1 in DB 1;
oldest/newest commit timestamp xid: 0/0; oldest running xid 0;
shutdown
pg_waldump: fatal: error in WAL record at 0/3F09FAF8: invalid record
length at 0/3F09FB70: wanted 24, got 0
Thelatestpg_waldumpmessageshowsthattheutilityhasreadthetotheend.
Let’sstarttheinstanceagain:
postgres$ pg_ctl start -l /home/postgres/logfile
10.5 Background Writing
Ifthebackendneedstoevictadirtypagefromabuffer,ithastowritethispageto
disk. Suchasituationisundesiredbecauseitleadstowaits—itismuchbetterto
performwritingasynchronouslyinthebackground.
Thisjobispartiallyhandledbycheckpointer,butitisstillnotenough.
198
10.6 WALSetup
Therefore, Postgre provides another process called bgwriter,1 specifically for
backgroundwriting.Itreliesonthesamebuffersearchalgorithmaseviction,except
forthetwomaindifferences:
• The bgwriter process uses its own clock hand that never lags behind that of
evictionandtypicallyovertakesit.
• Asthebuffersarebeingtraversed,theusagecountisnotreduced.
Adirtypageisflushedtodiskifthebufferisnotpinnedandhaszerousagecount.
Thus,bgwriterrunsbeforeevictionandproactivelywritestodiskthosepagesthat
arehighlylikelytobeevictedsoon.
Itraisestheoddsofthebuffersselectedforevictionbeingclean.
10.6 WAL Setup
Configuring Checkpoints
Thecheckpointduration(tobemoreexact,thedurationofwritingdirtybuffersto
disk)isdefinedbythecheckpoint_completion_target parameter. Itsvaluespecifies 0.9
thefractionoftimebetweenthestartsoftwoneighboringcheckpointsthatisallot- v.
tedtowriting.Avoidsettingthisparametertoone:asaresult,thenextcheckpoint
maybeduebeforethepreviousoneiscomplete. Nodisasterwillhappen,asitis